[
  {
    "retention_permanent_archive_schedule_snapshot_record_id": "retention-permanent-archive-schedule-snapshot-basic-restore-001",
    "permanent_archive_schedule_snapshot_kind": "retention_permanent_archive_schedule_snapshot",
    "created_time": "2026-01-01T00:08:28Z",
    "node_id": "formal-rollup-node-example",
    "retention_permanent_archive_policy_freeze_closeout_record_id": "retention-permanent-archive-policy-freeze-closeout-basic-restore-001",
    "retention_permanent_archive_policy_freeze_verification_receipt_id": "retention-permanent-archive-policy-freeze-verification-basic-restore-001",
    "permanent_archive_schedule_snapshot_state": "scheduled",
    "permanent_archive_schedule_snapshot_scope": "closed_retention_permanent_archive_policy_freeze",
    "permanent_archive_schedule_snapshot_refs": [
      "retention-permanent-archive-policy-freeze-closeout-basic-restore-001",
      "retention-permanent-archive-policy-freeze-verification-basic-restore-001",
      "retention-permanent-archive-policy-freeze-basic-restore-001",
      "retention/retention-policy.json"
    ],
    "subject_refs": [
      "retention-permanent-archive-accession-summary-verification-basic-restore-001",
      "retention-permanent-archive-accession-summary-basic-restore-001",
      "retention-terminal-permanent-closure-notice-closeout-basic-restore-001"
    ],
    "basis_refs": [
      "retention-permanent-archive-policy-freeze-closeout-basic-restore-001",
      "retention-permanent-archive-policy-freeze-verification-basic-restore-001",
      "retention/retention-policy.json"
    ],
    "digest_algorithm": "sha256-sorted-retention-permanent-archive-schedule-snapshot-ref-list",
    "permanent_archive_schedule_snapshot_ref_digest": "232cdc99680a4eb7e2b1034bb1655f1972584e7c60b31e84428fc44fd5f69cbb",
    "permanent_archive_schedule_snapshot_by_ref": "tools/pfem_retention_permanent_archive_schedule_snapshot_records.py",
    "summary": "Synthetic example retention permanent archive schedule snapshot record built from the closed retention permanent archive policy freeze path."
  }
]
